uniqueJobID|ref|brand|title|language|country|contractType|active|published|salary_max|salary_min|salary_show|content|status|updated|bulletPoints_0|bulletPoints_1|spare_title_1|spare_title_2|location_code|location_text|location_term|location_spare|job_detail_url
36714_MP_PL|36714|MP|Regionalny Dyrektor Sprzedaży FMCG|en|PL||1|2020-02-20 18:01:37|200000|190000|0|Dla naszego Klienta, międzynarodowej firmy z branży FMCG z kategorii napojowej, poszukujemy obecnie kandydatów na stanowisko Regionalnego Dyrektora Sprzedaży. Wybrana osoba będzie odpowiedzialna za realizację celów biznesowych, zarządzając strukturą 40+, na podległym terenie woj. mazowieckiego, łódzkiego, podlaskiego i warmińsko-mazurskiego.|1|2020-02-20 18:01:37|Doświadczenie z kategorią napojową lub alkoholową,|Znajomość obszaru woj. mazowieckiego - konieczne,|Regionalny Dyrektor Sprzedaży FMCG|Regionalny Dyrektor Sprzedaży FMCG|39054|Warsaw|Warsaw|Warsaw|https://www.michaelpage.pl/en/job-detail/regionalny-dyrektor-sprzeda%C5%BCy-fmcg/ref/36714
36864_MP_PL|36864|MP|Group Supply Chain Transformation Manager|en|PL||1|2020-02-20 18:06:50|2080|2080|0|Group Supply Chain Transformation Manager is a newly created position and its target is to play a key role in transformation and performance development of the Group's global supply chain structure.<br><br>The successful candidate will work closely with the Group Supply Chain &amp; Logistic Director, COO, Country Managers, Country Sales Directors and Group IT Director.<br><br>|1|2020-02-20 18:06:50|Take part in a global, complex transformation management project|Gain experience in a private equity portfolio company|Group Supply Chain Transformation Manager|Group Supply Chain Transformation Manager|39054|Warsaw|Warsaw|Warsaw|https://www.michaelpage.pl/en/job-detail/group-supply-chain-transformation-manager/ref/36864
16353_MP_PL|16353|MP|Shared Services Accountant (f/m/d)|en|PL||1|2020-02-21 12:54:03|281942|216879|1|Our customer is one of the worldwide leaders of the Fragrances and Flavour industry in fifth generation with more than 6000 employees and the Headquarters based in the south of France.<br><br>The company located in Austria serves as a regional headquarter for sales in the regions CEE, CIS and Turkey.<br><br>|1|2020-02-21 12:54:03|International and attractive field of activity|Independent and stable working environment |Shared Services Accountant (f/m/d)|Shared Services Accountant (f/m/d)|37115|Viena|Viena|Viena|https://www.michaelpage.pl/en/job-detail/shared-services-accountant-fmd/ref/16353
36793_MP_PL|36793|MP|Sales Manager Eastern Europe - Global Medical Devices Company|en|PL||1|2020-02-21 16:07:38|4|4|0|The objective of Sales Manager is to drive sales in entrusted region including but not limited to Poland, Czech Republic, Slovakia, Hungary, Baltic countries through both local lead generation and channel partners management.|1|2020-02-21 16:07:38|experience in distributor channel management in CEE|capital equipment|Sales Manager Eastern Europe - Global Medical Devices Company|Sales Manager Eastern Europe - Global Medical Devices Company|39031|Poland|Poland|Poland|https://www.michaelpage.pl/en/job-detail/sales-manager-eastern-europe-global-medical-devices-company/ref/36793
36780_MP_PL|36780|MP|Regionalny Kierownik Sprzedaży |pl|PL||1|2020-02-21 16:11:23|144000|120000|0|Osoba na tym stanowisku odpowiedzialna będzie za pozyskiwanie oraz utrzymywanie relacji z partnerami biznesowymi z branży leasingowej.|1|2020-02-21 16:11:23|Międzynarodowa instytucja finansowa|Regionalny Kierownik Sprzedaży|Regionalny Kierownik Sprzedaży |Regionalny Kierownik Sprzedaży |39054|Warszawa|Warsaw|Warszawa|https://www.michaelpage.pl/job-detail/regionalny-kierownik-sprzeda%C5%BCy/ref/36780
313400_MP_PL|313400|MP|Messaging & Collaboration Delivery Engineer|en|PL||1|2020-02-21 18:46:46|216879|195191|0|The Messaging and Collaboration Delivery Engineer is responsible for helping on design, implement and test information systems for a wide variety of enterprise systems inline with the global strategy and design maintained by the Strategy and Architecutre team and Infrastructure Solution Architect.<br><br>|1|2020-03-23 17:25:16|Great opportunity for IT Professionals|PageGroup Shared Services Centre|Messaging & Collaboration Delivery Engineer|Messaging & Collaboration Delivery Engineer|39358|Barcelona|Barcelona|Barcelona|https://www.michaelpage.pl/en/job-detail/messaging-collaboration-delivery-engineer/ref/313400
36668_MP_PL|36668|MP|Senior Tax Specialist (VAT / Indirect Tax Compliance team) |en|PL||1|2020-02-24 11:47:39|144000|96000|0|We are currently recruiting a Senior Tax Specialist to join our Clients VAT/Indirect Tax Compliance team whose primary responsibility will be to executive tax compliance activities for European entities reporting directly to the Tax Manager.|1|2020-02-24 11:47:39|Join one of the most recognizable brands in the world!|Attractive organic growth opportunities and a supportive corporate culture!|Senior Tax Specialist (VAT / Indirect Tax Compliance team) |Senior Tax Specialist (VAT / Indirect Tax Compliance team) |39054|Warsaw|Warsaw|Warsaw|https://www.michaelpage.pl/en/job-detail/senior-tax-specialist-vat-indirect-tax-compliance-team/ref/36668
36766_MP_PL|36766|MP|Financial Analyst|pl|PL||1|2020-02-24 12:25:52|131000|108000|0|Zatrudniony kandydat będzie odpowiedzialny za kontroling oraz analizy zarządcze dotyczące jednej z inwestycji spółki oraz wsparcie bardziej doświadczonych pracowników w zakresie pozostałej część portfolio. Jest to bardzo dobra okazja dla kandydatów pracujących w audycie finansowym lub firmach zarządzających nieruchomościami, aby przejść do wewnętrznego zespołu finansowego po stronie właściciela.|1|2020-03-16 12:57:40|Międzynarodowa spółka z branży nieruchomości komercyjnych|Min. 2 lata doświadczenia na podobnym stanowisku|Financial Analyst|Financial Analyst|39054|Warszawa|Warsaw|Warszawa|https://www.michaelpage.pl/job-detail/financial-analyst/ref/36766
36904_MP_PL|36904|MP|Księgowy ds. Zobowiązań (k/m)|en|PL||1|2020-02-24 14:22:13|1|1|0|Dla Naszego Klienta poszukujemy obecnie dwóch Kandydatów na pozycję Księgowego ds. Zobowiązań. Są to nowo utworzone stanowiska w organizacji, która obecnie rozpoczyna transformację biznesową celem utworzenia centrum finansowo-księgowego dla spółek należących do Grupy.|1|2020-02-24 14:22:13|Nowe stanowisko w strukturach firmy|Firma produkcyjna budująca w swoich strukturach centrum finansowo-księgowe|Księgowy ds. Zobowiązań (k/m)|Księgowy ds. Zobowiązań (k/m)|39076|Tychy|Tychy|Tychy|https://www.michaelpage.pl/en/job-detail/ksi%C4%99gowy-ds-zobowi%C4%85za%C5%84-km/ref/36904
36505_MP_PL|36505|MP|Customer Service Specialist|pl|PL||1|2020-02-24 15:57:57|2|1|0|Dla naszego klienta, międzynarodowej firmy produkcyjnej poszukuję osoby na stanowisko Customer Service Specialist.|1|2020-02-24 15:57:57|Międzynarodowa firma|Możliwość rozwoju|Customer Service Specialist|Customer Service Specialist|69493|Piła|Piła|Piła|https://www.michaelpage.pl/job-detail/customer-service-specialist/ref/36505
36916_MP_PL|36916|MP|Starszy Specjalista ds.płatności (k/m)|en|PL||1|2020-02-24 17:01:34|120000|120000|0|Dla Naszego Klienta poszukujemy obecnie dwóch Kandydatów na pozycję Starszy Specjalista ds. Pałatności. Są to nowo utworzone stanowiska w organizacji, która obecnie rozpoczyna transformację biznesową celem utworzenia centrum finansowo-księgowego dla spółek należących do Grupy.|1|2020-02-24 17:01:34|Nowe stanowisko w strukturach firmy|Firma produkcyjna budująca w swoich strukturach centrum finansowo-księgowe|Starszy Specjalista ds.płatności (k/m)|Starszy Specjalista ds.płatności (k/m)|39076|Tychy|Tychy|Tychy|https://www.michaelpage.pl/en/job-detail/starszy-specjalista-dsp%C5%82atno%C5%9Bci-km/ref/36916
36907_MP_PL|36907|MP|Presales Network Security Consultant|pl|PL||1|2020-02-24 17:08:44|192000|168000|0|Nasz Klient poszukuje osoby, która będzie odpowiedzialna za wsparcie w aktywnym poszukiwaniu i kreowaniu nowych produktów w zakresie rozwiązań sieciowych.<br><br>|1|2020-02-24 17:08:44|Nasz Klinet firma z branzy IT|Presales Network Security Consultant|Presales Network Security Consultant|Presales Network Security Consultant|39054|Warszawa|Warsaw|Warszawa|https://www.michaelpage.pl/job-detail/presales-network-security-consultant/ref/36907
36902_MP_PL|36902|MP|International Sales Manager ( f / m)|en|PL||1|2020-02-25 11:38:51|1|1|0|You will be responsible for developing, implementing, and execution of sales strategy which meets the company objectives of sales growth and earnings, while managing teams.|1|2020-02-26 16:57:26|International Sales Manager with technical background|Leading Software & IT outsourcing Company |International Sales Manager ( f / m)|International Sales Manager ( f / m)|39035|Wrocław|Wrocław|Wrocław|https://www.michaelpage.pl/en/job-detail/international-sales-manager-f-m/ref/36902
36917_MP_PL|36917|MP|IT Audit Manager (m/f)|en|PL||1|2020-02-25 11:51:13|240000|240000|0|The primary objective of this role is to plan, coordinate and conduct IT audits to ensure adequate controles are in place to migrate IT risk. Moreover, this person will evaluate compliance with all relevant policies and procedures to provide assurance that Company assets are properly safeguarded and areas for improvement are identified. This is an individual role and will report to the Group Head of Internal Audit.<br><br>|1|2020-02-25 11:51:13|Manufacturing Group that operates worldwide|Expert role in IT Audit|IT Audit Manager (m/f)|IT Audit Manager (m/f)|39049|Kraków|Kraków|Kraków|https://www.michaelpage.pl/en/job-detail/it-audit-manager-mf/ref/36917
36920_MP_PL|36920|MP|Senior Customer Service Manager (m/f)|en|PL||1|2020-02-25 16:02:25|1|1|0|For our Client we are looking for an experienced Senior Customer Operations Manager who will be responsible for leading and developing customer support operations within the Center of Excellence. The main goal of this role is to ensure the right organization and processes are in place. This will be a leadership role with a heavy focus on people as well as performance management and continuous process improvement. The role will be based in the Krakow Center of Excellence.<br><br>|1|2020-02-25 16:02:25|New Shared Service Centre in Kraków|Leading and developing customer service operations within Center of Excellence|Senior Customer Service Manager (m/f)|Senior Customer Service Manager (m/f)|39049|Kraków|Kraków|Kraków|https://www.michaelpage.pl/en/job-detail/senior-customer-service-manager-mf/ref/36920
36915_MP_PL|36915|MP|Customer Service Specialist with Russian|pl|PL||1|2020-02-25 16:03:50|2|1|0|Dla naszego klienta, skandynawskiej firmy produkcyjnej poszukuję osób na stanowisko Customer Service Specialist with Russian.|1|2020-02-25 16:03:50|Skandynawska organizacja|Możliwość rozowju|Customer Service Specialist with Russian|Customer Service Specialist with Russian|39054|Warszawa|Warsaw|Warszawa|https://www.michaelpage.pl/job-detail/customer-service-specialist-russian/ref/36915
36825_MP_PL|36825|MP|Kierownik Projektu (budowa mini-fabryki)|en|PL||1|2020-02-25 17:18:05|240000|240000|0|Osoba na tym stanowisku będzie odpowiedzialna za kompleksową realizację projektu inwestycyjnego od opracowania planu poprzez harmonogram do uruchomienia obszaru.|1|2020-02-25 17:18:05|Kierownie projektem uruchomienia Mini-Fabryki|Praca w nowoczesnej, dynamicznie rozwiwajacej się organizacji |Kierownik Projektu (budowa mini-fabryki)|Kierownik Projektu (budowa mini-fabryki)|39043|Lublin|Lublin|Lublin|https://www.michaelpage.pl/en/job-detail/kierownik-projektu-budowa-mini-fabryki/ref/36825
36839_MP_PL|36839|MP|Inżynier Procesu|en|PL||1|2020-02-26 11:20:35|120000|96000|0|Dla dla naszego Klienta z branży Automotive z okolic Zawiercia w związku z powiększeniem działu poszukujemy osoby na stanowisko Inżyniera Procesu.|1|2020-02-26 11:20:35|Międzynarodowa firma produkcyjna z branży Automotive;|Optymalizacja istniejących procesów produkcyjnych;|Inżynier Procesu|Inżynier Procesu|69519|Zawiercie|Zawiercie|Zawiercie|https://www.michaelpage.pl/en/job-detail/in%C5%BCynier-procesu/ref/36839
36937_MP_PL|36937|MP|Internal Audit Manager (m/f)|en|PL||1|2020-02-26 14:06:19|200000|144000|0|This role is responsible for the preparation and management of the Annual Audit plan and working with key stakeholders to agree timeframes within the specialist directives whilst leading and developing a newly established Auditing team.|1|2020-02-26 14:06:19|International Manufacturing Company|No business travels required|Internal Audit Manager (m/f)|Internal Audit Manager (m/f)|39035|Wrocław|Wrocław|Wrocław|https://www.michaelpage.pl/en/job-detail/internal-audit-manager-mf/ref/36937
36938_MP_PL|36938|MP|Freight Operations Manager (m/f)|en|PL||1|2020-02-26 14:16:04|1|1|0|For our Clint, we are looking for Candidate who will be responsible for leading and developing customer service operations within freight in the Center of Excellence. The role will support all of the European activities on the carrier side. The complexity of the process around this role will be related to the support function of the acquisition of of carries.<br><br>|1|2020-02-26 14:16:04|New Shared Service Centre in Kraków|Build and runn effective, scalable support operations for freight business line|Freight Operations Manager (m/f)|Freight Operations Manager (m/f)|39049|Kraków|Kraków|Kraków|https://www.michaelpage.pl/en/job-detail/freight-operations-manager-mf/ref/36938
36589_MP_PL|36589|MP|Dyrektor Sprzedaży|en|PL||1|2020-02-26 15:27:10|216000|180000|0|Dla naszego klienta szukamy osoby na stanowisko Dyrektora Sprzedaży odpowiedzialnego za kształtowanie i realizację planów i strategii sprzedażowej Firmy na rynku krajowym i rynkach eksportowych. Do kluczowych zadań należeć będzie także rozwój biznesu poprzez poszukiwanie i pozyskiwanie nowych klientów i rynków dla produktów firmy.|1|2020-02-26 15:27:10|Firma produkcyjna - tworzywa sztuczne|Dyrektor Sprzedaży - raportowanie do Prezesa Zarządu|Dyrektor Sprzedaży|Dyrektor Sprzedaży|39065|Silesia|Silesia|Silesia|https://www.michaelpage.pl/en/job-detail/dyrektor-sprzeda%C5%BCy/ref/36589
36939_MP_PL|36939|MP|RtR Accounting Manager|en|PL||1|2020-02-26 16:31:02|168000|120000|0|On this position you will be managing a team of up to 15 RTR accountants responsible for accountign activities for various entites im EMEA region.|1|2020-03-03 17:35:25|International Company is looking for RtR Accounting Manager|Developing structures|RtR Accounting Manager|RtR Accounting Manager|39085|Poznań|Poznań|Poznań|https://www.michaelpage.pl/en/job-detail/rtr-accounting-manager/ref/36939
36906_MP_PL|36906|MP|Kupiec - branża medyczna|pl|PL||1|2020-02-26 18:32:52|2|1|0|Dla naszego klienta, skandynawskiej firmy z branży medycznej, poszukujemy zmotywowanych kandydatów/ek na nowotworzone stanowisko Specjalisty ds. zakupów. Osoba na tym stanowisku będzie ulokowana w dziale finansów i będzie odpowiadać za wsparcie przetargów i realizacji projektów od strony zakupowo-negocjacyjnej, jak też dbać o dokumentację i rozliczenia z dostawcami od strony compliance.|1|2020-02-26 18:32:52|Skandynawska firma medyczna|Nowotworzone stanowisko Kupca projektowego|Kupiec - branża medyczna|Kupiec - branża medyczna|39054|Warszawa|Warsaw|Warszawa|https://www.michaelpage.pl/job-detail/kupiec-bran%C5%BCa-medyczna/ref/36906
36942_MP_PL|36942|MP|Property Manager (Investor)|en|PL||1|2020-02-27 10:06:05|156|104|0|Poszukujemy doświadczonej osoby na stanowisko Property Managera.|1|2020-02-27 10:06:05|Portfel dwóch budynów biurowych w centrum Warszawy |Deweloper i zarządca nieruchomości |Property Manager (Investor)|Property Manager (Investor)|39054|Warsaw|Warsaw|Warsaw|https://www.michaelpage.pl/en/job-detail/property-manager-investor/ref/36942
36943_MP_PL|36943|MP|Financial Controller Central Europe (m/f)|en|PL||1|2020-02-27 10:48:38|1|1|0|An exciting role for experienced financial controllers willing to develop themselves in regional role.|1|2020-02-27 10:48:38|Regional controlling / SAP / international company |Silesia / logistics company|Financial Controller Central Europe (m/f)|Financial Controller Central Europe (m/f)|39065|Silesia|Silesia|Silesia|https://www.michaelpage.pl/en/job-detail/financial-controller-central-europe-mf/ref/36943
36944_MP_PL|36944|MP|Hardware Engineer / Konstruktor Elektronik R&D|pl|PL||1|2020-02-27 12:14:55|1440000|1152000|0|<ul><li>Doskonała szansa na rozwój w międzynarodowej organizacji, w ramach centrum badawczo - rozwojowego w samym sercu Wrocławia!</li><li>Wymagania: min. 3 lata doświadczenia w projektowaniu układów / schematów elektrycznych + znajomość j. angielskiego</li></ul>|1|2020-02-27 12:14:55|Wrocław, centrum miasta, nowoczesne centrum R&D|konstrukcja elektroniki, wymagane min. 3 lata doświadczenia|Hardware Engineer / Konstruktor Elektronik R&D|Hardware Engineer / Konstruktor Elektronik R&D|39035|Wrocław|Wrocław|Wrocław|https://www.michaelpage.pl/job-detail/hardware-engineer-konstruktor-elektronik-rd/ref/36944
36919_MP_PL|36919|MP|Finance Manager (start-up project) |en|PL||1|2020-02-27 17:03:20|240000|216000|0|The chosen candidate will be supporting CFO (Poland) and Managing Director during the start-up project with various financial activities (controlling &amp; accounting). Manufacturing site is located next to Radom.<br><br>|1|2020-02-27 17:03:20|Member of the start-up project of the Polish entity next to Radom |Play an active role in the management team of the company|Finance Manager (start-up project) |Finance Manager (start-up project) |39053|Radom|Radom|Radom|https://www.michaelpage.pl/en/job-detail/finance-manager-start-project/ref/36919
36893_MP_PL|36893|MP|Kontroler Finansowy|en|PL||1|2020-02-28 11:10:05|12000|12000|0|Poszukujemy kandydata na stanowisko Kontrolera Finansowego. Kontroler będzie będzie miał realny impakt na biznes i jego rozwój.|1|2020-02-28 11:10:05|Międzynarodowa Firma produkcyjna|Kontroler będzie będzie miał realny impakt na biznes i jego rozwój|Kontroler Finansowy|Kontroler Finansowy|39034|Wałbrzych|Wałbrzych|Wałbrzych|https://www.michaelpage.pl/en/job-detail/kontroler-finansowy/ref/36893
36933_MP_PL|36933|MP|Inżynier Produktu - transformatory i przekaźniki|en|PL||1|2020-02-28 11:38:31|108000|72000|0|Nasz klient planuje rozwój obszaru R&amp;D w zakładzie w Polsce - w związku z tym poszukujemy osoby, która wzmocni istniejący zespół R&amp;D w wykreowaniu i rozwinięciu nowych urządzeń elektrotechnicznych.|1|2020-02-28 12:16:12|Projektowanie urządzeń elektrotechnicznych|Międzynarodowa firma z planami rozwoju w obszarze R&D|Inżynier Produktu - transformatory i przekaźniki|Inżynier Produktu - transformatory i przekaźniki|39049|Kraków|Kraków|Kraków|https://www.michaelpage.pl/en/job-detail/in%C5%BCynier-produktu-transformatory-i-przeka%C5%BAniki/ref/36933
36796_MP_PL|36796|MP|Internal Auditor|en|PL||1|2020-02-28 11:52:13|15000|12000|0|Poszukujemy osoby, która będzie odpowiedzialna za samodzielne prowadzenie audytów procesowych w obszarze całej spółki.|1|2020-02-28 11:52:13|Międzynarodowa Firma Produkcyjna|Udział w tworzeniu nowych procesów i procedur|Internal Auditor|Internal Auditor|39035|Wrocław|Wrocław|Wrocław|https://www.michaelpage.pl/en/job-detail/internal-auditor/ref/36796
36965_MP_PL|36965|MP|Kierownik wydziału produkcji |en|PL||1|2020-02-28 13:17:49|156000|132000|0|Osoba na tym stanowisku będzie odpowiedzialna za zarządzanie wydziałem produkcyjnym w tym zarządzanie zespołem.|1|2020-02-28 13:17:49|Międzynarodowa firma z branży opakowań |Zarządzanie wydziałem produkcyjnym|Kierownik wydziału produkcji |Kierownik wydziału produkcji |39049|Kraków|Kraków|Kraków|https://www.michaelpage.pl/en/job-detail/kierownik-wydzia%C5%82u-produkcji/ref/36965
16415_MP_PL|16415|MP|Corporate Product Director (m/f)|en|PL||1|2020-02-28 17:11:10|650636|433758|0|Become Corporate Product Director (m/f) on headquarter level with reporting line to the CCO for international market leader in medical services with flexibility in location.|1|2020-02-28 17:11:10|Become Corporate Product Director (m/f) on group level!|Headquarter opportunity with international market leader in medical services.|Corporate Product Director (m/f)|Corporate Product Director (m/f)|10|International|International|International|https://www.michaelpage.pl/en/job-detail/corporate-product-director-mf/ref/16415
36531_MP_PL|36531|MP|Digital Marketing Specialsit|en|PL||1|2020-02-28 18:01:31|108000|96000|0|"Obecnie do zespołu marketingu poszukujemy kandydata na stanowisko samodzielnego Digital Marketing Specialisty, który wniesie „know how"" do organizacji oraz będzie aktywnie współtworzyć strategię marketingu w kanale internetowym wraz z Marketing Manager."|1|2020-02-28 18:01:31|Planowaniem oraz koordynacja komunikacji online marki|firma z branży wykończenia wnętrz|Digital Marketing Specialsit|Digital Marketing Specialsit|39054|Warsaw|Warsaw|Warsaw|https://www.michaelpage.pl/en/job-detail/digital-marketing-specialsit/ref/36531
36977_MP_PL|36977|MP|Specjalista ds. zapewnienia jakości ( k/m)|en|PL||1|2020-02-28 18:09:17|108000|96000|0|W związku z rozwojem struktury szukamy osoby na stanowisko Specjalisty ds. zapewnienia jakości|1|2020-02-28 18:09:17|Firma z branży FMCG|Wrocław|Specjalista ds. zapewnienia jakości ( k/m)|Specjalista ds. zapewnienia jakości ( k/m)|39035|Wrocław|Wrocław|Wrocław|https://www.michaelpage.pl/en/job-detail/specjalista-ds-zapewnienia-jako%C5%9Bci-km/ref/36977
36952_MP_PL|36952|MP|Senior Java Software Engineer|en|PL||1|2020-03-02 11:35:49|181000|180000|0|Our client is an international provider of communication platforms. They facilitate communication between business and people across the globe. <br />We are looking for a senior java developer that will join the newly formed team.|1|2020-03-02 11:35:49|New start-up in Katowice|International projects related to communication channels|Senior Java Software Engineer|Senior Java Software Engineer|39072|Katowice|Katowice|Katowice|https://www.michaelpage.pl/en/job-detail/senior-java-software-engineer/ref/36952
36972_MP_PL|36972|MP|Samodzielna Księgowa/Z-ca Gł. Księgowej - stabilna organizacja|pl|PL||1|2020-03-02 12:26:57|120000|96000|0|Kandydat/ka będzie odpowiedzialna/y za prowadzenie podmiotów na pełnej księgowości oraz wspieranie Gł. Księgowej w bieżących obowiązkach. <br />Propozycja skierowana do osób, które poszukują pracy z ciekawym (niewycinkowym) zakresem zadań w stabilnej firmie, która dynamicznie się rozwija. <br />Poszukujemy osoby ceniącej zespołowe podejście do pracy, dobre relacje międzyludzkie i zmotywowanej do rozwoju umiejętności.|1|2020-03-02 12:26:57|Doświadczenie w kalkulacji podatków i przygotowywaniu sprawozdań fin. |Dobrze skomunikowana lokalizacja |Samodzielna Księgowa/Z-ca Gł. Księgowej - stabilna organizacja|Samodzielna Księgowa/Z-ca Gł. Księgowej - stabilna organizacja|39054|Warszawa|Warsaw|Warszawa|https://www.michaelpage.pl/job-detail/samodzielna-ksi%C4%99gowaz-ca-g%C5%82-ksi%C4%99gowej-stabilna-organizacja/ref/36972
36930_MP_PL|36930|MP|Program Manager (with German language)|en|PL||1|2020-03-02 12:54:09|240000|180000|0|For our Client - an international producer from Automotive industry - we are looking for an experienced Program Manager.|1|2020-03-02 12:54:09|Experienced Candidate in project / program management in automotive sector;|Strong leadership and experience in managing teams;|Program Manager (with German language)|Program Manager (with German language)|39065|Silesia|Silesia|Silesia|https://www.michaelpage.pl/en/job-detail/program-manager-german-language/ref/36930
36971_MP_PL|36971|MP|Księgowa/y - stabilna organizacja - dobra lokalizacja  |pl|PL||1|2020-03-02 13:01:20|84000|72000|0|"Kandydat/ka będzie miał styczność z pracą na rzecz 2-3 spółek.<br />Propozycja skierowana do osób, które poszukują pracy z niewycinkowym zakresem obowiązków w stabilnej organizacji, która dynamicznie się rozwija. <br />Poszukujemy osoby ceniącej ""duch zespołu"", komunikatywnej, otwartej i zmotywowanej do rozwoju umiejętności."|1|2020-03-02 13:01:20|Przekrojowe obowiązki rachunkowe|Dobrze skomunikowana lokalizacja|Księgowa/y - stabilna organizacja - dobra lokalizacja  |Księgowa/y - stabilna organizacja - dobra lokalizacja  |39054|Warszawa|Warsaw|Warszawa|https://www.michaelpage.pl/job-detail/ksi%C4%99goway-stabilna-organizacja-dobra-lokalizacja/ref/36971
36755_MP_PL|36755|MP|Office Coordinator|pl|PL||1|2020-03-02 14:25:01|108000|78000|0|Dla naszego klienta, prestiżowej firmy z branży nieruchomości, poszukujemy samodzielnego koordynatora, odpowiedzialnego za wsparcie biura.|1|2020-03-02 14:25:01|Międzynarodowa firma z branży nieruchomości|Samodzielne stanowisko w obszarze administracji|Office Coordinator|Office Coordinator|39054|Warszawa|Warsaw|Warszawa|https://www.michaelpage.pl/job-detail/office-coordinator/ref/36755
36969_MP_PL|36969|MP|Service Engineer|en|PL||1|2020-03-02 14:31:05|2|1|0|Dla naszego klienta poszukujemy bardzo doświadczonego Inżyniera Serwisu specjalizującego się w obsłudze oraz serwisowaniu sprzętu RTG.|1|2020-03-02 14:31:05|Międzynarodowa organizacja - sprzęt medyczny|Inżynier Serwisu - RTG|Service Engineer|Service Engineer|39065|Silesia|Silesia|Silesia|https://www.michaelpage.pl/en/job-detail/service-engineer/ref/36969
