uniqueJobID|ref|brand|title|language|country|contractType|active|published|salary_max|salary_min|salary_show|content|status|updated|bulletPoints_0|bulletPoints_1|spare_title_1|spare_title_2|location_code|location_text|location_term|location_spare|job_detail_url
35432_MP_PL|35432|MP|Python Developer |en|PL||1|2019-12-06 13:50:05|2|1|0|As a Python web developer you will own the architecture development of the product. Collaborating with team members in product management, design and engineering, you will create the backbone of the applications, explore ideas and iterate on solutions. <br><br>|1|2019-12-06 13:50:05|Interested in working within startup enviroment?|Ready to take on the ownership of the project upon you?|Python Developer |Python Developer |39054|Warsaw|Warsaw|Warsaw|https://www.michaelpage.pl/en/job-detail/python-developer/ref/35432
36063_MP_PL|36063|MP|Front-end Web Developer|en|PL||1|2019-12-06 14:02:21|2|1|0|As a front-end web developer you will own the client-facing development of the product. Collaborating with team members in product management, design and engineering, you will create smooth experiences, explore ideas and iterate on solutions.|1|2019-12-06 14:02:21|Interested in working within startup enviroment?|Ready to take on the ownership of the project upon you?|Front-end Web Developer|Front-end Web Developer|39054|Warsaw|Warsaw|Warsaw|https://www.michaelpage.pl/en/job-detail/front-end-web-developer/ref/36063
36133_MP_PL|36133|MP|Transition Manager |en|PL||1|2019-12-06 17:42:12|240000|240000|0|Our Client, one of the most recognizable brands, is seeking an experienced Transition / Project Manager to join its Shared Services structures.<br><br>The successful candidate will have the unique opportunity to acquire vast experience in project management and participated in transformation projects across Europe!|1|2020-02-06 13:45:52|A unique opportunity to join one of the most recognizable brands! |Partcipate in transition projects across Europe |Transition Manager |Transition Manager |39054|Warsaw|Warsaw|Warsaw|https://www.michaelpage.pl/en/job-detail/transition-manager/ref/36133
36065_MP_PL|36065|MP|Senior Front-End Developer|en|PL||1|2019-12-09 16:34:33|2|1|0|Na tym stanowisku będziesz odpowiedzialny za ciągły rozwój funkcjonalności serwisu e-commerce, oraz za kod po stronie front-endu na najwyższym poziomie.|1|2019-12-09 16:34:33|Jesteś gotów pracować z liderem w branży?|Wazny jest dla Ciebie rozwój osobisty?|Senior Front-End Developer|Senior Front-End Developer|39054|Warsaw|Warsaw|Warsaw|https://www.michaelpage.pl/en/job-detail/senior-front-end-developer/ref/36065
36119_MP_PL|36119|MP|Continuous Improvement Expert|pl|PL||1|2019-12-09 19:04:14|1|1|0|W związku z rozwojem organizacji, poszukujemy dla naszego klienta specjalisty na stanowisko Continuous Improvement Expert. Osoba na tym stanowisku będzie odpowiedzialna za inicjowanie, organizowanie, koordynowanie oraz wspieranie działań mających na celu optymalizację procesów produkcyjnych w zakładzie oraz szerzenia kultury lean.|1|2019-12-09 19:04:14|Międzynarodowa firma produkcyjna|Możliwość pracy w jednym z dwóch zakładów w woj. mazowieckim|Continuous Improvement Expert|Continuous Improvement Expert|39051|Mazowieckie|Masovia|Mazowieckie|https://www.michaelpage.pl/job-detail/continuous-improvement-expert/ref/36119
36071_MP_PL|36071|MP|Sourcing Specialist|en|PL||1|2019-12-10 10:35:03|2|1|0|Naszym klientem jest międzynarodowa francuska firma produkcyjna. W związku z ambitnymi planami ekspansji organizacja tworzy nowe zespoły Sourcingowe. Jeśli chcesz się rozwijać, zdobyć doświadczenie w obszarze zakupów, zachęcamy do aplikowania na stanowisko Sourcing Specialist.|1|2019-12-10 10:35:03|Lokalizacja w centrum Warszawy|Miedzynarodowa organizacja|Sourcing Specialist|Sourcing Specialist|39054|Warsaw|Warsaw|Warsaw|https://www.michaelpage.pl/en/job-detail/sourcing-specialist/ref/36071
35503_MP_PL|35503|MP|Accountant with German (m/f)|en|PL||1|2019-12-10 12:18:36|144000|84000|0|For our client, an international company, with growing exposure, we are looking for an experienced individual for the role of Accountant to strengthen its local operations.|1|2020-01-10 16:11:15|F&A Business Services|Independent Accountant|Accountant with German (m/f)|Accountant with German (m/f)|39035|Wrocław|Wrocław|Wrocław|https://www.michaelpage.pl/en/job-detail/accountant-german-mf/ref/35503
36158_MP_PL|36158|MP|Specjalista ds. wsparcia systemów|en|PL||1|2019-12-10 14:17:21|121000|120000|0|Międzynarodowa firma z branży IT poszukuje specjalisty ds. wsparcia systemów.|1|2019-12-10 14:17:21|Specjalista ds. wsparcia systemów|Międzynarodowa firma z branży IT|Specjalista ds. wsparcia systemów|Specjalista ds. wsparcia systemów|39051|Masovia|Masovia|Masovia|https://www.michaelpage.pl/en/job-detail/specjalista-ds-wsparcia-system%C3%B3w/ref/36158
36122_MP_PL|36122|MP|Samodzielny Specjalista ds. Ryzyka Kredytowego|en|PL||1|2019-12-11 11:41:26|1|1|0|W związku z rozwojem struktur w obszarze Zarządzania Ryzykiem poszukujemy doświadczonego kandydata na stanowisko Samodzielnego Specjalisty ds. Ryzyka Kredytowego.|1|2019-12-11 11:41:26|znajomość ryzyka kredytowego, analiza portfela kredytowego Klientów|modele liczenia rezerw, IFRS|Samodzielny Specjalista ds. Ryzyka Kredytowego|Samodzielny Specjalista ds. Ryzyka Kredytowego|39051|Masovia|Masovia|Masovia|https://www.michaelpage.pl/en/job-detail/samodzielny-specjalista-ds-ryzyka-kredytowego/ref/36122
36057_MP_PL|36057|MP|Samodzielna Księgowa / Samodzielny Księgowy|pl|PL||1|2019-12-11 12:02:20|120000|108000|0|Dla naszego Klienta, spółki z branży deweloperskiej, poszukujemy osoby na stanowisko Samodzielnej Księgowej / Samodzielnego Księgowego. <br />Kandydat/ka będzie odpowiedzialny za bezpośrednie wspieranie Głównej Księgowej oraz pełną obsługę księgową spółek celowych należących do grupy. <br />Poszukujemy osoby z sektora nieruchomości, posiadających doświadczenie w branży.|1|2019-12-11 12:02:20|Samodzielne prowadzenie wybranych spółek celowych |Branża deweloperska - Centrum |Samodzielna Księgowa / Samodzielny Księgowy|Samodzielna Księgowa / Samodzielny Księgowy|39054|Warszawa|Warsaw|Warszawa|https://www.michaelpage.pl/job-detail/samodzielna-ksi%C4%99gowa-samodzielny-ksi%C4%99gowy/ref/36057
36172_MP_PL|36172|MP|Senior HR Business Partner |en|PL||1|2019-12-11 15:31:04|161000|160000|0|For our client, we are looking for experienced HR Business Partner. Required candidate must have proven track record in being a serious Business Partner for local management and management at the Group Level within international environment.|1|2019-12-11 15:31:04|Globally recognized consumer goods company trading within FMCG sector|Partner for the managment team|Senior HR Business Partner |Senior HR Business Partner |39054|Warsaw|Warsaw|Warsaw|https://www.michaelpage.pl/en/job-detail/senior-hr-business-partner/ref/36172
36182_MP_PL|36182|MP|Główna Księgowa|en|PL||1|2019-12-12 11:13:28|168000|14000|0|Dla naszego Klienta, międzynarodowej firmy produkcyjnej, poszukujemy osoby na stanowisko Głównego Księgowego / Głównej Księgowej. Wybrany kandydat będzie odpowiadał za pełną księgowość spółki i współpracować z Dyrektorem Finansowym<br><br>|1|2019-12-12 11:13:28|Międzynarodowa Firma Produkcyjna |Firma znajduje się w okolicach Środy Ślaskiej|Główna Księgowa|Główna Księgowa|39035|Wrocław|Wrocław|Wrocław|https://www.michaelpage.pl/en/job-detail/g%C5%82%C3%B3wna-ksi%C4%99gowa/ref/36182
36166_MP_PL|36166|MP|Supply Chain Controller|en|PL||1|2019-12-13 14:40:04|121000|120000|0|We are looking for Supply Chain controller who has already gained his first experience in the controlling area, and would like to develop his skills in the new environment.|1|2019-12-13 14:40:04|New Financial Center of Excellence that is established in a manufacturing Group|New position on the market allocated on the Group level|Supply Chain Controller|Supply Chain Controller|39072|Katowice|Katowice|Katowice|https://www.michaelpage.pl/en/job-detail/supply-chain-controller/ref/36166
36128_MP_PL|36128|MP|Launch Manager (interim)|pl|PL||1|2019-12-13 16:40:22|181000|180000|0|Doskonała szansa na wsparcie międzynarodowej organizacji w kluczowym dla niej projekcie - uruchomieniu zupełnie nowego programu, w samym sercu Wrocławia.|1|2019-12-13 16:40:22|Wrocław, Automotive, nowy projekt (niemiecki klient)|kontrakt b2b do końca 2020 r., atrakcyjne wynagrodzenie|Launch Manager (interim)|Launch Manager (interim)|39035|Wrocław|Wrocław|Wrocław|https://www.michaelpage.pl/job-detail/launch-manager-interim/ref/36128
36189_MP_PL|36189|MP|Tax Team Leader / Indirect Tax (VAT) |en|PL||1|2019-12-13 18:40:28|216000|156000|0|Our Client is seeking an experienced and highly motivated Tax Team Leader to join its Shared Service structures in Warsaw.|1|2019-12-13 18:40:28|A unique opportunity to join one of the most recognizable brands in the world!|Participate in regional tax projects |Tax Team Leader / Indirect Tax (VAT) |Tax Team Leader / Indirect Tax (VAT) |39054|Warsaw|Warsaw|Warsaw|https://www.michaelpage.pl/en/job-detail/tax-team-leader-indirect-tax-vat/ref/36189
36117_MP_PL|36117|MP|Financial Controller (m/f)|en|PL||1|2019-12-16 14:14:50|12|12|0|As our perfect candidate, you can operate easily with Management and Financial Accounting, Data Analytics, and Legal tasks. We need a flexible person willing to help us with a diverse scope of responsibilities.<br><br>|1|2019-12-16 14:14:50|software house / product studio / home office whole Poland |Google sheets / great office in Cracow / informal environment|Financial Controller (m/f)|Financial Controller (m/f)|39031|Poland|Poland|Poland|https://www.michaelpage.pl/en/job-detail/financial-controller-mf/ref/36117
36147_MP_PL|36147|MP|Development Baker|en|PL||1|2019-12-17 13:59:49|120000|96000|0|Efektywne wspieranie Działu Rozwoju Nowych Produktów pod kątem spełnienia wymagań Klienta. Zapewnienie najlepszych usług dla Działu Handlowego i Działu Rozwoju, a także bieżące śledzenie realizowanych działań, wspieranie zespołów operacyjnych, bieżące dokumentowanie i wprowadzanie danych do systemów, oraz wykonywanie zadań związanych z pomyślnym ukończeniem projektów.<br><br>|1|2019-12-17 15:55:42|Efektywne wspieranie Działu Rozwoju Nowych Produktów |Bieżące śledzenie realizowanych działań oraz wspieranie zespołów operacyjnych|Development Baker|Development Baker|39066|Bielsko-Biała|Bielsko-Biała|Bielsko-Biała|https://www.michaelpage.pl/en/job-detail/development-baker/ref/36147
36033_MP_PL|36033|MP|Project Manager (elektronika)|pl|PL||1|2019-12-17 14:51:22|145000|144000|0|Szansa na rozwój managerski w centrum R&amp;D międzynarodowej firmy produkcyjnej.|1|2019-12-17 14:51:22|Wrocław, centrum R&D, elektronika|wymagania: j. angielski + j. niemiecki |Project Manager (elektronika)|Project Manager (elektronika)|39035|Wrocław|Wrocław|Wrocław|https://www.michaelpage.pl/job-detail/project-manager-elektronika/ref/36033
36217_MP_PL|36217|MP|Dyrektor Handlowy (Wentylacja przemysłowa)|pl|PL||1|2019-12-18 17:14:17|200000|180000|0|Dla naszego Klienta poszukujemy odpowiedniego profilu na stanowisko Dyrektor Handlowy. Osoba na tym stanowisku będzie odpowiedzialna za zbudowanie strategii sprzedaży a także jej wdrożenie. Osoba ta będzie odpowiedzialna za kilkuosobowy dział sprzedaży a raportowanie będzie odbywało się do Dyrektora Zarządzającego.|1|2019-12-20 09:26:46|Odpowiedzalność za sprzedaż na terenie całej Polski|Współtworzenie i realizacja krótko oraz długoterminowej strategii sprzedaży|Dyrektor Handlowy (Wentylacja przemysłowa)|Dyrektor Handlowy (Wentylacja przemysłowa)|39087|Koszalin|Koszalin|Koszalin|https://www.michaelpage.pl/job-detail/dyrektor-handlowy-wentylacja-przemys%C5%82owa/ref/36217
35296_MP_PL|35296|MP|Senior R&D Engineer - EMEA |en|PL||1|2019-12-18 18:39:15|108000|96000|0|Lead the R&amp;D activities and team consisting of Technicians, Engineers and Project Manager - collaboration across EMEA teams.|1|2019-12-18 18:39:15|Great career development opportunity in the regional R&D team|Globally recognised manufacturing company|Senior R&D Engineer - EMEA |Senior R&D Engineer - EMEA |39070|Dąbrowa Górnicza|Dąbrowa Górnicza|Dąbrowa Górnicza|https://www.michaelpage.pl/en/job-detail/senior-rd-engineer-emea/ref/35296
36178_MP_PL|36178|MP|Kierownik Utrzymania Ruchu (m/f)|en|PL||1|2019-12-18 19:02:42|216000|144000|0|Dla naszego klienta - międzynarodowej firmy produkcyjnej o ugruntowanej pozycji rynkowej szukamy osoby na stanowisko Kierownika Utrzymania Ruchu, która będzie odpowiedzialna za zarządzanie bardzo dobrze funkcjonującym obszarem.|1|2019-12-18 19:02:42|Międzynarodowa firma produkcyjna z branży Automotive|Zarządzanie obszarem Utrzymania Ruchu |Kierownik Utrzymania Ruchu (m/f)|Kierownik Utrzymania Ruchu (m/f)|39033|Legnica|Legnica|Legnica|https://www.michaelpage.pl/en/job-detail/kierownik-utrzymania-ruchu-mf/ref/36178
35743_MP_PL|35743|MP|Inżynier sieciowy|en|PL||1|2019-12-19 09:44:00|144000|120000|0|<ul><li>Firma informatyczna realizująca projekty IT poszukuje inżyniera sieciowego, który będzie odpowiedzialny za świadczenie usług IT z obszaru sieciowego, bezpieczeństwa, utrzymania ciągłości działania sieci informatycznych oraz ich monitorowaniu.</li></ul>|1|2020-01-21 11:46:18|Firma informatyczna realizująca projekty IT|Inżynier sieciowy|Inżynier sieciowy|Inżynier sieciowy|39054|Warsaw|Warsaw|Warsaw|https://www.michaelpage.pl/en/job-detail/in%C5%BCynier-sieciowy/ref/35743
35744_MP_PL|35744|MP|Architekt Rozwiązań Sieciowych|en|PL||1|2019-12-19 09:59:28|144000|120000|0|Firma specjalizująca się w dostarczaniu usług z zakresu infrastruktury sieciowej i informatycznej poszukuje osoby na stanowisko Architekta ds. Rozwiązań Sieciowych.|1|2020-01-21 11:50:40|Firma informatyczna realizująca projekty IT|Architekt Rozwiązań Sieciowych|Architekt Rozwiązań Sieciowych|Architekt Rozwiązań Sieciowych|39054|Warsaw|Warsaw|Warsaw|https://www.michaelpage.pl/en/job-detail/architekt-rozwi%C4%85za%C5%84-sieciowych/ref/35744
36165_MP_PL|36165|MP|Radca Prawny|en|PL||1|2019-12-19 15:18:10|2|1|0|Wsparcie Departamentu Prawnego i Compliance w bieżącej obsłudze prawnej spółek.|1|2019-12-19 15:18:10|Prawo własności intelektualnych, Prawo ubezpieczeń, Prawo Konsumenckie|FSI, Instytucja Finansowa, Leasing, Ubezpieczenia|Radca Prawny|Radca Prawny|39054|Warsaw|Warsaw|Warsaw|https://www.michaelpage.pl/en/job-detail/radca-prawny/ref/36165
36273_MP_PL|36273|MP|Treasury specialist|pl|PL||1|2019-12-19 16:37:52|120000|84000|0|W związku z rozbudową działu finansów poszukujemy kandydata na stanowisko Treasury Specialist. Kandydat/ka będzie odpowiedzialna za prowadzenie transakcji heandgingowych, optymalizację procesów płatności oraz zarządzanie płynnością i ryzykiem. Jest to idealna okazja na rozwój oraz wykorzystanie w praktyce wiedzy z zakresu finansów dla osoby z minimum 3 letnim doświadczeniem w tym obszarze.<br><br>|1|2019-12-19 16:37:52|Centrum Warszawy - retail|min. 3 lata w obszarze finansów|Treasury specialist|Treasury specialist|39054|Warszawa|Warsaw|Warszawa|https://www.michaelpage.pl/job-detail/treasury-specialist/ref/36273
36264_MP_PL|36264|MP|Kierownik Projektu- Hotele|en|PL||1|2019-12-19 16:49:10|24|12|0|Wybrana osoba będzie odpowiedzialna za przygotowanie oraz realizację projektów inwestycyjnych w segmencie hotelowym. Poszukujemy mobilnej osoby ponieważ stanowisko wiąże się częstymi podróżami pomiędzy projektem realizowanym w Poznaniu, a siedzibą firmy w Warszawie.|1|2019-12-19 16:49:10|Zarządzanie projektami hotelowymi|Mobilna praca Warszawa/Poznań|Kierownik Projektu- Hotele|Kierownik Projektu- Hotele|39085|Poznań|Poznań|Poznań|https://www.michaelpage.pl/en/job-detail/kierownik-projektu-hotele/ref/36264
36146_MP_PL|36146|MP|Head of Indirect Procurement|en|PL||1|2019-12-19 17:36:48|2|1|0|The purpose of this role is to take responsibility for managing the supply base to leverage cost savings and deliver contractual compliance as well as building a trusted platform for procurement to be adopted in the region.<br><br>|1|2019-12-19 17:36:48|Strategic Category Management (Marketing, Capex, Transport, Business Services)|Spend management up to 250 MLN EUR with 10+ strategic buyers|Head of Indirect Procurement|Head of Indirect Procurement|39054|Warsaw|Warsaw|Warsaw|https://www.michaelpage.pl/en/job-detail/head-indirect-procurement/ref/36146
36283_MP_PL|36283|MP|Specjalista ds. zakupów indirect - branża farmaceutyczna|pl|PL||1|2019-12-19 19:22:20|2|1|0|Do międzynarodowych struktur działu zakupów poszukujemy zmotywowanych kandydatów, zainteresowanych rozwojem w branży. Osoba na tym stanowisku będzie odpowiadać za prowadzenie projektów zakupowych w bliskiej współpracy z klientem wewnętrznym.|1|2019-12-19 19:22:20|Innowacyjna firma farmaceutyczna|Samodzielne stanowisko, międzynarodowe środowisko|Specjalista ds. zakupów indirect - branża farmaceutyczna|Specjalista ds. zakupów indirect - branża farmaceutyczna|39054|Warszawa|Warsaw|Warszawa|https://www.michaelpage.pl/job-detail/specjalista-ds-zakup%C3%B3w-indirect-bran%C5%BCa-farmaceutyczna/ref/36283
36219_MP_PL|36219|MP|Kierownik Produkcji |en|PL||1|2019-12-20 09:39:34|1|1|0|Dla naszego klienta klienta, prężnie rozwijającej się firmy produkcyjnej proszukujemy Kierownika Produkcji który będzie zarzadzał 200 osobowym zespołem.|1|2019-12-20 09:39:34|Międzynarodowa organizacja- lider w swoim obszarze|Firma zlokalizowana w woj. zachodniopomorskim |Kierownik Produkcji |Kierownik Produkcji |39086|Western Pomerania|Western Pomerania|Western Pomerania|https://www.michaelpage.pl/en/job-detail/kierownik-produkcji/ref/36219
36284_MP_PL|36284|MP|Product Manager - Lider of Home Security|en|PL||1|2019-12-20 10:13:01|2|1|0|"<p>Closely work together with the commercial team, product development and Business Line Team to streamline product management and development. This in line with the strategy of the AXA organization to help optimize the business growth</p>
"|1|2019-12-20 11:41:18|Work for an organization that is part of a large Allegion group - home seciurity|Building and roll out of strategic planning and maintaining of product portfolio|Product Manager - Lider of Home Security|Product Manager - Lider of Home Security|69519|Zawiercie|Zawiercie|Zawiercie|https://www.michaelpage.pl/en/job-detail/product-manager-lider-home-security/ref/36284
36281_MP_PL|36281|MP|CAD Engineer|en|PL||1|2019-12-20 11:27:59|120000|80000|0|Z racji na dynamiczny rozwój i przeniesienie ról do Polski dla swojego Klienta, międzynarodowej firmy z branży Autmotive, poszukujemy osoby na stanowisko CAD Engineer.<br><br>|1|2019-12-20 11:27:59|Projektowanie elementów z tworzyw sztucznych (CATIA, Creo);|Kandydata z min. 3 - letnim doświadczeniem w obszarze projektowania CAD;|CAD Engineer|CAD Engineer|69519|Zawiercie|Zawiercie|Zawiercie|https://www.michaelpage.pl/en/job-detail/cad-engineer/ref/36281
36285_MP_PL|36285|MP|Production Manager - Mechaniczne Elementy Metalowe|en|PL||1|2019-12-20 11:29:52|2|1|0|W związku z dalszym dynamicznym rozwojem spółki poszukujemy kandydatów, którzy będą zarządzać pełnym spectrum produkcji i utrzymania ruchu. Idealny profil kompetencji obejmuje ugruntowane doświadczenie w obszarze zarządzania produkcją seryjną, montażem i mechaniką z nastawieniem na narzędzia Lean i promowanie kultury Lean w zespołach.|1|2019-12-20 12:01:11|Greenfield - Lider produkcji mechanicznych elementów metalowych|Zarządzanie zespołem produkcji i utrzymania ruchu|Production Manager - Mechaniczne Elementy Metalowe|Production Manager - Mechaniczne Elementy Metalowe|39070|Dąbrowa Górnicza|Dąbrowa Górnicza|Dąbrowa Górnicza|https://www.michaelpage.pl/en/job-detail/production-manager-mechaniczne-elementy-metalowe/ref/36285
35890_MP_PL|35890|MP|Szef Sprzedaży|en|PL||1|2019-12-20 11:52:56|1|1|0|<ul><li>Osiągnięcie wyznaczonych celów promocyjno-sprzedażowych z<br />zachowaniem wyznaczonych kosztów budżetowych i zapewnienia pełnej<br />dostępności określonej grupy preparatów specjalistycznych.</li><li>Zarządzanie podległym zespołem sprzedażowym na terenie całego kraju.</li></ul>|1|2019-12-20 11:52:56|Doświadczenie w zarządzaniu strukturami sprzedaży terytorialnej w firmach|Międzynarodowa firma farmaceutyczna |Szef Sprzedaży|Szef Sprzedaży|39054|Warsaw|Warsaw|Warsaw|https://www.michaelpage.pl/en/job-detail/szef-sprzeda%C5%BCy/ref/35890
34922_MP_PL|34922|MP|Ksiegowa / Księgowy|en|PL||1|2019-12-20 13:08:30|1152000|720000|0|Poszukujemy osób na zainteresowanych stanowiskiem Księgowa / Księgowy. Jest to idealna okazja na wykorzystanie w praktyce ugruntowanej wiedzy z zakresu księgowości dla osoby z minimum 2 letnim doświadczeniem na podobnym stanowisku. Osoba będzie mogła wykazać się inicjatywą i samodzielnością w działaniu oraz będzie ściśle współpracować z Główną Księgową.|1|2019-12-20 13:08:30|Międzynarodowa Spółka specjalizująca się w wynajmie i leasingu pojazdów|Minumum 2-3 lata doświadczenia na podobnym stanowisku|Ksiegowa / Księgowy|Ksiegowa / Księgowy|39054|Warsaw|Warsaw|Warsaw|https://www.michaelpage.pl/en/job-detail/ksiegowa-ksi%C4%99gowy/ref/34922
36296_MP_PL|36296|MP|HR / Recruitment Manager|en|PL||1|2019-12-20 13:48:35|192000|180000|0|The HR Manager will be working close with a Head of Shared Services Center, management teams and other managers. You will have also an access to knowledge sharing with other international team across the region. Main focus of this role will be management of the end-to-end recruitment process.|1|2019-12-20 14:58:11|International technology Company - Financial SSC|A fully independent position|HR / Recruitment Manager|HR / Recruitment Manager|39054|Warsaw|Warsaw|Warsaw|https://www.michaelpage.pl/en/job-detail/hr-recruitment-manager/ref/36296
36309_MP_PL|36309|MP|RtR Accounting Specialist with English |en|PL||1|2019-12-20 16:16:51|84000|84000|0|What could be better than joining expanding Mars Global Services dedicated to Financial Operations? We have immediate career opportunities for Financial Operations Specialists who want to progress their careers in Finance and Accounting, develop analytical skills and participate in international projects.|1|2019-12-20 16:16:51|Mars FSSC is developing!|Michael Page is recruiting for Mars!|RtR Accounting Specialist with English |RtR Accounting Specialist with English |39085|Poznań|Poznań|Poznań|https://www.michaelpage.pl/en/job-detail/rtr-accounting-specialist-english/ref/36309
36290_MP_PL|36290|MP|Senior Analyst / Analyst (Corporate Finance)|en|PL||1|2019-12-20 16:29:39|144000|108000|0|The successful candidate in the position of Senior Analyst/Analyst will be mainly responsible for preparing market research and financial analysis in relation to potential merger &amp; acquisition and equity capital markets transactions opportunities and transactions. This is an excellent opportunity to join a newly-formed team working on very interesting prospect transactions.<br><br>|1|2019-12-20 16:29:39|A prestigious Scandinavian investment bank |Preparing market reasearch for global companies |Senior Analyst / Analyst (Corporate Finance)|Senior Analyst / Analyst (Corporate Finance)|39054|Warsaw|Warsaw|Warsaw|https://www.michaelpage.pl/en/job-detail/senior-analyst-analyst-corporate-finance/ref/36290
36295_MP_PL|36295|MP|Information Services|en|PL||1|2019-12-20 16:29:49|91000|90000|0|The successful candidate in the position of Information Services Specialist will be responsible mainly for data maintenance and sourcing for clients based in Nordic countries. This is an excellent opportunity to join a newly-formed team working on interesting prospect transactions.<br><br>|1|2019-12-20 16:29:49|Prestigious Scandinavian Investment Bank|Data maintenance and sourcing for clients!|Information Services|Information Services|39054|Warsaw|Warsaw|Warsaw|https://www.michaelpage.pl/en/job-detail/information-services/ref/36295
36207_MP_PL|36207|MP|Kierownik Budowy|pl|PL||1|2019-12-20 16:54:45|9|4|0|Osoba na stanowisku Kierownika Budowy będzie odpowiedzialna za kierowanie oraz koordynację prac budowlanych, zarządzanie wydatkami na budowie, kontrolę jakości oraz nadzór nad podległymi pracownikami.|1|2019-12-20 16:54:45|Firma specjalizująca się w budownictwie elektroenergetycznym|Kierowanie pracami budowlanymi|Kierownik Budowy|Kierownik Budowy|39031|Polska|Poland|Polska|https://www.michaelpage.pl/job-detail/kierownik-budowy/ref/36207
36286_MP_PL|36286|MP|Senior Comodity Manager EMEA|en|PL||1|2019-12-20 17:08:14|20000|19000|0|Person on that position would be responsible for regional commodity strategy development and execution for assigned commodities.|1|2019-12-20 17:08:14|Global production company - leader in the industry|Lead commodity and people management |Senior Comodity Manager EMEA|Senior Comodity Manager EMEA|69519|Zawiercie|Zawiercie|Zawiercie|https://www.michaelpage.pl/en/job-detail/senior-comodity-manager-emea/ref/36286
