uniqueJobID|ref|brand|title|language|country|contractType|active|published|salary_max|salary_min|salary_show|content|status|updated|bulletPoints_0|bulletPoints_1|spare_title_1|spare_title_2|location_code|location_text|location_term|location_spare|job_detail_url
28207_MP_PL|28207|MP|Key Account Manager - Central European Market|pl|PL||1|2018-05-21 18:26:51|2|1|0|Dla naszego Klienta, międzynarodowej firmy z branży FMCG, poszukujemy kandydatów na stanowisko Key Account Managera na rynki międzynarodowe. Wybrana osoba będzie odpowiedzialna za sprzedaż produktów firmy na rynku krajów skandynawskich.|1|2019-10-24 08:28:02|Doświadczenie w zarządzaniu relacjami z Klientami w branży FMCG|Samodzielność i sukcesy w pozyskiwaniu nowych partnerów biznesowych|Key Account Manager - Central European Market|Key Account Manager - Central European Market|39038|Grudziądz|Grudziądz|Grudziądz|https://www.michaelpage.pl/job-detail/key-account-manager-central-european-market/ref/28207
29408_MP_PL|29408|MP|Księgowy w obszarze General Ledger(RTR) (K/M)|en|PL||1|2018-05-28 11:28:16|84000|60000|0|Dla naszego klienta - nowo powstającego centrum biznesowego - globalnej, dynamicznie rozwijającej się firmy - w związku z tworzeniem nowego działu finansowego poszukujemy doświadczonej osoby na stanowisko Specjalisty w obszarze Księgi Głównej.|1|2020-03-20 14:56:26|Nowo powstające centrum wsparcia operacji biznesowych|Szeroki obszar księgowości|Księgowy w obszarze General Ledger(RTR) (K/M)|Księgowy w obszarze General Ledger(RTR) (K/M)|39035|Wrocław|Wrocław|Wrocław|https://www.michaelpage.pl/en/job-detail/ksi%C4%99gowy-w-obszarze-general-ledgerrtr-km/ref/29408
295193_MP_PL|295193|MP|Mobile UA Specialist (h/m) - Social Game Developer|en|PL||1|2019-01-15 09:53:37|260255|173503|0|Do you want to be part of a worldwide mobile games leader? Our client is an international company existing of about 300 talented professionals, based in sunny and cosmopolitan Barcelona. They create amazing games, positioned in the top rankings of both iOS and Android, that are played and loved by over 50 million fans all over the world.|1|2019-12-04 11:24:35|Opportunity for experienced (3+ years) mobile acquisition specialist|Worldwide mobile games leader based in Barcelona|Mobile UA Specialist (h/m) - Social Game Developer|Mobile UA Specialist (h/m) - Social Game Developer|39358|Barcelona|Barcelona|Barcelona|https://www.michaelpage.pl/en/job-detail/mobile-ua-specialist-hm-social-game-developer/ref/295193
32291_MP_PL|32291|MP|Automatyk (k/m)|pl|PL||1|2019-01-24 16:50:26|75000|72000|0|Obecnie poszukujemy kandydatów zainteresowanych pracą w firmie produkcyjnej na stanowisku Automatyka.|1|2020-02-12 21:06:22|Duża międzynarodowa firma produkcyjna (FMCG)|Świdnica|Automatyk (k/m)|Automatyk (k/m)|125114|Świdnica|Świdnica|Świdnica|https://www.michaelpage.pl/job-detail/automatyk-km/ref/32291
32722_MP_PL|32722|MP|Financial Planning & Analysis Expert (New Operations Center)|en|PL||1|2019-02-08 17:06:21|120000|108000|0|Support the globalFP&amp;A commercial and manufacturing processes, like planning and budgeting that supports the strategic objectives of the Center of Excellence.<br><br> <br><br>|1|2019-11-14 16:43:13|Supporting global FP&A commercial processes|Supports  continuous improvements and standardization initiatives|Financial Planning & Analysis Expert (New Operations Center)|Financial Planning & Analysis Expert (New Operations Center)|39054|Warsaw|Warsaw|Warsaw|https://www.michaelpage.pl/en/job-detail/financial-planning-analysis-expert-new-operations-center/ref/32722
32854_MP_PL|32854|MP|Inżynier ds. Obliczeń i Analiz (k/m)|en|PL||1|2019-03-17 20:44:18|120000|84000|0|Obecnie, poszukujemy kandydatów zainteresowanych pracą w globalnym centrum R&amp;D na stanowisku Inżyniera ds. Obliczeń i Analiz.|1|2020-02-12 21:32:45|Praca w globalnym centrum R&D|Wrocław|Inżynier ds. Obliczeń i Analiz (k/m)|Inżynier ds. Obliczeń i Analiz (k/m)|39035|Wrocław|Wrocław|Wrocław|https://www.michaelpage.pl/en/job-detail/in%C5%BCynier-ds-oblicze%C5%84-i-analiz-km/ref/32854
33261_MP_PL|33261|MP|Compliance Specialist with Nordic languages|en|PL||1|2019-03-18 13:12:18|72000|72000|0|We are looking for Nordic languages speaker (Swedish, Finnish, Danish and/or Norwegian) who would like to join international team dedicated to support Nordic market. This is a great opportunity for individuals with medical devices knowledge gained in medical devices industry or<br><br> <br><br>|1|2019-11-06 15:24:33|Advances Swedish, Finnish, Danish and/or Norwegian |Medical devices knowledge required|Compliance Specialist with Nordic languages|Compliance Specialist with Nordic languages|39054|Warsaw|Warsaw|Warsaw|https://www.michaelpage.pl/en/job-detail/compliance-specialist-nordic-languages/ref/33261
32838_MP_PL|32838|MP|Technik Automatyk |pl|PL||1|2019-03-19 14:05:51|24|12|0|Osoba na stanowisku Technika Automatyka będzie odpowiedzialna za konserwacje i naprawę maszyn w zakresie automatyki.|1|2019-11-06 10:41:24|Firma produkcyjna - branża FMCG|Programowanie sterowników Siemens, Mitsubishi, Omron, itp.|Technik Automatyk |Technik Automatyk |39054|Warszawa|Warsaw|Warszawa|https://www.michaelpage.pl/job-detail/technik-automatyk/ref/32838
33579_MP_PL|33579|MP|Dyrektor Finansowy|en|PL||1|2019-04-15 10:51:36|240000|240000|0|Dla naszego Klienta poszukujemy doświadczonego Dyrektora Finansowego.<br><br>|1|2019-11-22 17:22:33|Dynamicznie rozwijająca się Firma Produkcyjno-Handlowa|Doświadczony Dyrektor Finansowy |Dyrektor Finansowy|Dyrektor Finansowy|39032|Lower Silesia|Lower Silesia|Lower Silesia|https://www.michaelpage.pl/en/job-detail/dyrektor-finansowy/ref/33579
32838_MP_PL|32838|MP|Technik Automatyk |en|PL||1|2019-05-08 11:53:43|24|12|0|Osoba na stanowisku Technika Automatyka będzie odpowiedzialna za konserwacje i naprawę maszyn w zakresie automatyki.|1|2019-11-06 10:41:24|Firma produkcyjna - branża FMCG|Programowanie sterowników Siemens, Mitsubishi, Omron, itp.|Technik Automatyk |Technik Automatyk |39054|Warsaw|Warsaw|Warsaw|https://www.michaelpage.pl/en/job-detail/technik-automatyk/ref/32838
33759_MP_PL|33759|MP|Junior Trade Marketing Manager|pl|PL||1|2019-05-13 19:03:28|109000|108000|0|Dla naszego Klienta, przedstawiciela niemieckich producentów z branży FMCG, w tym jednego o ponad 100-letniej tradycji w dostarczaniu najwyższej klasy produktów, dostępnych w ponad 30. krajach, rekrutuję Kandydatów - na stanowisko Jr Trade Marketing Managera - z min. 2-letnim doświadczeniem w trade marketingu w firmach z branży FMCG o mniejszej strukturze, z rozwiniętymi kompetencjami PR-owymi i zacięciem digitalowym.<br><br>|1|2019-11-08 16:02:45|2-letnie doświadczenie w trade marketingu w branży FMCG w mniejszych strukturach|- kompetencje PR-owe/ kreatywność /wielozadaniowość/ samodzielne stanowisko|Junior Trade Marketing Manager|Junior Trade Marketing Manager|39054|Warszawa|Warsaw|Warszawa|https://www.michaelpage.pl/job-detail/junior-trade-marketing-manager/ref/33759
34253_MP_PL|34253|MP|Senior PTP or OTC Specialist with French language|en|PL||1|2019-06-19 14:53:51|96000|96000|0|Our Client is the international company engaged in development of data-management solutions in IT area. Due to start of the new team, dedicated to internal medical entity, they need French speaker with experience in PTP or OTC area.|1|2019-11-04 11:00:23|Medical Unit in the international company|Experience in accounting and French language|Senior PTP or OTC Specialist with French language|Senior PTP or OTC Specialist with French language|39049|Kraków|Kraków|Kraków|https://www.michaelpage.pl/en/job-detail/senior-ptp-or-otc-specialist-french-language/ref/34253
32291_MP_PL|32291|MP|Automatyk (k/m)|en|PL||1|2019-07-01 17:36:22|75000|72000|0|Obecnie poszukujemy kandydatów zainteresowanych pracą w firmie produkcyjnej na stanowisku Automatyka.|1|2019-11-24 19:51:54|Duża międzynarodowa firma produkcyjna (FMCG)|Świdnica|Automatyk (k/m)|Automatyk (k/m)|125114|Świdnica|Świdnica|Świdnica|https://www.michaelpage.pl/en/job-detail/automatyk-km/ref/32291
34512_MP_PL|34512|MP|Procurement Specialist with German - New SSC! |en|PL||1|2019-07-12 16:02:05|96000|72000|0|The primary responsibility of this role is to manage delivering centralised indirect purchasing services in accordance with the organisation's strategic direction. As a future employee, you will have a chance to create a team from scratch in a newly created SSC in Warsaw.<br><br>|1|2020-01-29 17:33:44|Possibility to work in newly developing structures!|Opportunity to use German on a daily basis! |Procurement Specialist with German - New SSC! |Procurement Specialist with German - New SSC! |39054|Warsaw|Warsaw|Warsaw|https://www.michaelpage.pl/en/job-detail/procurement-specialist-german-new-ssc/ref/34512
34830_MP_PL|34830|MP|Technik Utrzymania Ruchu (k/m)|pl|PL||1|2019-08-11 19:33:35|65000|60000|0|Obecnie poszukujemy kandydatów zainteresowanych pracą w firmie produkcyjnej na stanowisku Technika Utrzymania Ruchu.|1|2020-02-12 21:04:01|Praca w systemie 4-brygadowym|Duża międzynarodowa firma produkcyjna|Technik Utrzymania Ruchu (k/m)|Technik Utrzymania Ruchu (k/m)|125114|Świdnica|Świdnica|Świdnica|https://www.michaelpage.pl/job-detail/technik-utrzymania-ruchu-km/ref/34830
34797_MP_PL|34797|MP|Financial Controller|en|PL||1|2019-08-12 15:48:32|12|12|0|Osoba na tym stanowisku dołączy do zespołu i będzie współpracować z Controlling Manager oraz Dyrektorem Finansowym. Będzie w pełni odpowiedzialna za kontrolę finansową i biznesową SPV i aktywnych projektów.<br><br>Jest to idealna okazana dla osoby z minimum 4 letnim doświadczeniem zawodowym w zakresie analizy i kontroli finansowe (najlepiej w nieruchomościach) na kolejny krok w karierze i dołączenie do znanej spółki pełnej wartości i odpowiedniego podejścia do pracownika.|1|2020-01-31 10:58:44|IFRS, raportowanie, kontrola finansowa, spółki celowe, praca z bankami |Nieruchomości komercyjne, możliwości rozowju, |Financial Controller|Financial Controller|39054|Warsaw|Warsaw|Warsaw|https://www.michaelpage.pl/en/job-detail/financial-controller/ref/34797
34845_MP_PL|34845|MP|SQL Data Developer|en|PL||1|2019-08-12 16:27:18|120000|120000|0|Currently we are looking for SQL Data Developer to drive data quality awareness and remediation guidance to application service lines and account teams.|1|2020-02-24 09:50:44|Developing and implementing data quality rules and support|Global exposure - EMEA, AM and APAC regions|SQL Data Developer|SQL Data Developer|39054|Warsaw|Warsaw|Warsaw|https://www.michaelpage.pl/en/job-detail/sql-data-developer/ref/34845
34968_MP_PL|34968|MP|Area Sales Manager|pl|PL||1|2019-08-28 15:18:10|181000|180000|0|Jeśli jesteś managerem nastawionym na rozwój biznesu, a ludzi i relacje stawiasz na pierwszym miejscu- aplikuj!<br><br> <br><br>|1|2019-10-14 08:57:30|Lider w branży retail.|Marka o zasięgu globalnym.|Area Sales Manager|Area Sales Manager|39051|Mazowieckie|Masovia|Mazowieckie|https://www.michaelpage.pl/job-detail/area-sales-manager/ref/34968
34860_MP_PL|34860|MP|Division Designer - Packaging Business (corrugated industry)|en|PL||1|2019-08-30 11:53:50|200000|200000|0|We are looking for a highly motivated and skilled Division Designer who has the ability of understanding the customers' business situation and needs and translate it into packaging opportunities for global omnichannel logistics chains. This position involves a wide diversity of work situations and requires the ability to manage multiple projects efficiently. <strong>The workplace is located in beautiful Riga, Latvia. Relocation is a must.</strong>|1|2019-10-11 14:55:03|International job opportunity, the position is based in Latvia (beautiful Riga) |International team, new position in the company, interesting projects|Division Designer - Packaging Business (corrugated industry)|Division Designer - Packaging Business (corrugated industry)|39054|Warsaw|Warsaw|Warsaw|https://www.michaelpage.pl/en/job-detail/division-designer-packaging-business-corrugated-industry/ref/34860
34993_MP_PL|34993|MP|Inżynier lean - Six Sigma koordynator (m/f)|en|PL||1|2019-08-30 12:28:15|156000|84000|0|"<p>Dla naszego klienta - międzynarodowej firmy produkcyjnej zlokalizowanej w Legnicy szukamy doświadczonej osoby do działu Lean / Six Sigma, która będzie odpowiedzialna za prowadzenie projektów optymalizacyjnych.</p>
"|1|2019-10-28 15:10:25|Międzynarodowa firma produkcyjna |Branża Automotive |Inżynier lean - Six Sigma koordynator (m/f)|Inżynier lean - Six Sigma koordynator (m/f)|39033|Legnica|Legnica|Legnica|https://www.michaelpage.pl/en/job-detail/in%C5%BCynier-lean-six-sigma-koordynator-mf/ref/34993
34861_MP_PL|34861|MP|Division Designer (Project Management) - Packaging Business |en|PL||1|2019-08-30 12:45:18|200000|200000|0|We are looking for a highly motivated and skilled Division Designer who has the ability of understanding the customers' business situation and needs and translate it into packaging opportunities for global omnichannel logistics chains. This position involves a wide diversity of work situations and requires the ability to manage multiple projects efficiently. <strong>The workplace is located in beautiful Riga, Latvia. Relocation is a must.</strong>|1|2019-10-11 14:53:00|International company - corrugated industry / Position is located in Riga,Latvia|New position in the company / External projects across the matrix organisation. |Division Designer (Project Management) - Packaging Business |Division Designer (Project Management) - Packaging Business |39054|Warsaw|Warsaw|Warsaw|https://www.michaelpage.pl/en/job-detail/division-designer-project-management-packaging-business/ref/34861
34978_MP_PL|34978|MP|Technolog |en|PL||1|2019-08-30 15:08:44|2|1|0|"<p>Z uwagi na wzrastającą liczbę realizowanych projektów, dla naszego klienta poszukujemy osoby doświadczonej w optymalizowaniu procesów wydobycia oraz przerobu surowców naturalnych. Nadrzędnym zadaniem osoby na tym stanowisku będzie optymalizowanie procesów w całym ciągu technologicznym zakładu.<br />
	&nbsp;</p>
"|1|2019-10-28 15:10:06|Dynamicznie rozwijająca się firma z branży wydobywczej, obróbka surowca|Technolog - Optymalizacja procesów wydobycia i przerobu|Technolog |Technolog |39041|Łódź|Łódź|Łódź|https://www.michaelpage.pl/en/job-detail/technolog/ref/34978
35131_MP_PL|35131|MP|Logistics Manager|en|PL||1|2019-09-12 18:22:57|16000|12000|0|Zarządzanie obszarami planowania produkcji, magazynu, obsługi klienta, zaopatrzenia oraz tworzenie i realizacja budżetu.<br><br>|1|2020-01-03 15:24:50|Międzynarodowa firma produkcyjna|Organizacja i zarządzanie przepływami logistycznymi przedsiębiorstwa|Logistics Manager|Logistics Manager|39032|Lower Silesia|Lower Silesia|Lower Silesia|https://www.michaelpage.pl/en/job-detail/logistics-manager/ref/35131
35146_MP_PL|35146|MP|Security Operation Center Manager|en|PL||1|2019-09-13 16:14:07|16000|15000|0|Candidates in this role will oversee and coordinate the activities of SOC personnel and implement security assessment and incident response protocols.<br><br>|1|2020-01-21 16:38:42|Company from technology sector based in Warsaw|Security Operation Center Manager|Security Operation Center Manager|Security Operation Center Manager|39054|Warsaw|Warsaw|Warsaw|https://www.michaelpage.pl/en/job-detail/security-operation-center-manager/ref/35146
35156_MP_PL|35156|MP|RTR Accountant with English|en|PL||1|2019-09-16 13:01:46|96000|66000|0|We are looking for English speaking candidates with experience in the GL department. The successful candidate will be responsible among others for supporting period end reporting, fixed assets, account reconciliations and audits.<br><br>|1|2020-03-19 16:59:47|Well known SSC in Warsaw is hiring!|At least 2-3 years of experience in the RTR department|RTR Accountant with English|RTR Accountant with English|39054|Warsaw|Warsaw|Warsaw|https://www.michaelpage.pl/en/job-detail/rtr-accountant-english/ref/35156
34830_MP_PL|34830|MP|Technik Utrzymania Ruchu (k/m)|en|PL||1|2019-09-19 14:26:07|65000|60000|0|Obecnie poszukujemy kandydatów zainteresowanych pracą w firmie produkcyjnej na stanowisku Technika Utrzymania Ruchu.|1|2020-02-12 21:04:01|Praca w systemie 4-brygadowym|Duża międzynarodowa firma produkcyjna|Technik Utrzymania Ruchu (k/m)|Technik Utrzymania Ruchu (k/m)|125114|Świdnica|Świdnica|Świdnica|https://www.michaelpage.pl/en/job-detail/technik-utrzymania-ruchu-km/ref/34830
GO18_MP_PL|GO18|MP|Supply Chain Executives, Coordinators or Analysts|en|PL||1|2019-09-20 15:22:00|720041|144008|1|Are you a Supply Chain Executive/Coordinator/Analyst moving to London?<br><br>Our Procurement &amp; Supply chain recruitment team in London can assist with your job search if you are relocating to London|1|2020-03-13 17:27:03|- Relocating to London from overseas and looking for your first job placement |- Recruiting for multiple supply chain opportunities across London|Supply Chain Executives, Coordinators or Analysts|Supply Chain Executives, Coordinators or Analysts|10|International|International|International|https://www.michaelpage.pl/en/job-detail/supply-chain-executives-coordinators-or-analysts/ref/go18
35252_MP_PL|35252|MP|Cybersecurity Specialist|pl|PL||1|2019-09-23 12:55:26|131000|130000|0|Stanowisko dotyczące bezpieczeństwa IT|1|2019-10-17 15:24:56|Globalna firma oferująca rozwiązania technologiczne|Wsparcie z zakresu cyberbezpieczeństwa|Cybersecurity Specialist|Cybersecurity Specialist|39072|Katowice|Katowice|Katowice|https://www.michaelpage.pl/job-detail/cybersecurity-specialist/ref/35252
35320_MP_PL|35320|MP|Kierownik Robót Elektrycznych (m/f)|pl|PL||1|2019-09-30 13:22:39|121000|120000|0|W związku z rozwojem biznesu i nowymi, bardzo różnorodnymi projektami (o wartości kilkudziesięciu mln PLN) na terenie całej Polski, nasz Klient poszukuje Kandydatów na stanowisko Kierownika Robót Elektrycznych (o elektrycznym / elektrotechnicznym wykształceniu). To doskonała szansa dla osób szukających szybkiego rozwoju zawodowego! :-)|1|2019-12-03 18:02:32|firma: lider w projektach budowlanych / inwestycyjnych w energetyce i przemyśle|praca na terenie Polski Centralnej lub Zachodniej; do dyspozycji auto służbowe |Kierownik Robót Elektrycznych (m/f)|Kierownik Robót Elektrycznych (m/f)|39031|Polska|Poland|Polska|https://www.michaelpage.pl/job-detail/kierownik-rob%C3%B3t-elektrycznych-mf/ref/35320
35278_MP_PL|35278|MP|VBA Developer (financial reports)|en|PL||1|2019-10-02 15:12:20|120000|120000|0|We are seeking to recruit experienced Report Developer with advanced VBA knowledge.<br><br>|1|2020-03-10 11:01:24|New Center of Excellence in Warsaw!|Advanced VBA skills required!|VBA Developer (financial reports)|VBA Developer (financial reports)|39054|Warsaw|Warsaw|Warsaw|https://www.michaelpage.pl/en/job-detail/vba-developer-financial-reports/ref/35278
306675_MP_PL|306675|MP|ASO Manager - Gaming Industry|en|PL||1|2019-10-02 18:11:37|260255|216879|0|As<strong> AOS Manager</strong> you will be in charge of developing and implementing the App Store Optimization (ASO) strategy of all the games. This position is based in Barcelona. Only candidates with solid work experience with ASO will be consider (at least 4+ years).|1|2019-12-04 11:33:05|Developing and implementing the App Store Optimization (ASO) strategy |Well-known international player in Gaming industry|ASO Manager - Gaming Industry|ASO Manager - Gaming Industry|39358|Barcelona|Barcelona|Barcelona|https://www.michaelpage.pl/en/job-detail/aso-manager-gaming-industry/ref/306675
35380_MP_PL|35380|MP|IT Security Engineer |pl|PL||1|2019-10-03 14:04:25|156000|86000|0|IT Security Engineer|1|2019-10-10 12:21:53|Międzynarodowa firma z sektora finansowego|IT Security Engineer |IT Security Engineer |IT Security Engineer |39054|Warszawa|Warsaw|Warszawa|https://www.michaelpage.pl/job-detail/it-security-engineer/ref/35380
35036_MP_PL|35036|MP|Senior Manager - Quality Assurance Regulatory Affairs|en|PL||1|2019-10-09 13:51:22|2|1|0|Senior Manager - QARA - EMEA's primary responsibilities include monitoring and ensuring compliance to international requirements, staying abreast of new and revised regulations, assure New Product Introductions comply with internal and international regulatory requirements, assure on-market products comply with internal and international regulatory requirements, manage internal and external audits and inspections.|1|2019-10-31 11:52:01|At least 4 years of experience in the field of Quality and Regulatory area|Fluent english|Senior Manager - Quality Assurance Regulatory Affairs|Senior Manager - Quality Assurance Regulatory Affairs|39054|Warsaw|Warsaw|Warsaw|https://www.michaelpage.pl/en/job-detail/senior-manager-quality-assurance-regulatory-affairs/ref/35036
35468_MP_PL|35468|MP|Kupiec indirect - Professional Services|pl|PL||1|2019-10-10 12:15:42|2|1|0|Dla naszego klienta, międzynarodowej firmy z branży kosmetycznej, poszukujemy zmotywowanych kandydatów na stanowisko kupca w kategorii usług i serwisów. Osoba na tym stanowisku będzie odpowiadać za prowadzenie projektów w bliskiej współpracy z klientami wewnętrznymi, oraz realizację celów zakupowych.|1|2019-10-10 12:15:42|Międzynarodowa firma produkcyjna z branży kosmetycznej|Możliwość dalszego rozwoju w matrycowej, międzynarodowej strukturze|Kupiec indirect - Professional Services|Kupiec indirect - Professional Services|39054|Warszawa|Warsaw|Warszawa|https://www.michaelpage.pl/job-detail/kupiec-indirect-professional-services/ref/35468
35443_MP_PL|35443|MP|Junior Risk Specialist|en|PL||1|2019-10-10 14:34:27|5000|4000|0|The successful candidate will have unique opportunity to develop further in interesting areas connected to KYC/AML, Data Protection and Sanctions.|1|2019-10-10 14:34:27|Dynamic and growing Risk Team|An international organisation|Junior Risk Specialist|Junior Risk Specialist|39054|Warsaw|Warsaw|Warsaw|https://www.michaelpage.pl/en/job-detail/junior-risk-specialist/ref/35443
35441_MP_PL|35441|MP|Lider Magazynu m/f|en|PL||1|2019-10-11 11:52:28|9000|7000|0|Osoba na tym stanowisku będzie odpowiedzialna za planowanie, organizowanie i kontrolowanie procesów związanych z płynnym przepływem logistycznym na magazynie.<br><br> <br><br> <br><br>|1|2019-10-11 11:52:28|Międzynarodowa firma produkcyjna |Koordynowacja pracy magazynu |Lider Magazynu m/f|Lider Magazynu m/f|39065|Silesia|Silesia|Silesia|https://www.michaelpage.pl/en/job-detail/lider-magazynu-mf/ref/35441
35486_MP_PL|35486|MP|IT Infrastructure Manager|en|PL||1|2019-10-11 15:10:37|220000|200000|0|"<p>The Infrastructure Manager has overall responsibility for setting out the infrastructure strategy and road map, developing the Group Policies and standards and for the successful execution of the infrastructure strategy.<br />
	&nbsp;</p>
"|1|2019-12-30 13:10:16|head of infrastructure team|new SSC based in Katowice|IT Infrastructure Manager|IT Infrastructure Manager|39072|Katowice|Katowice|Katowice|https://www.michaelpage.pl/en/job-detail/it-infrastructure-manager/ref/35486
35431_MP_PL|35431|MP|Konstruktor Elektronik R&D|pl|PL||1|2019-10-11 16:42:00|91000|90000|0|Doskonała szansa na rozwój zawodowy w środowisku najnowszych technologii i branży pełnej wyzwań, tuż pod Wrocławiem. Biuro badawczo - rozwojowe poszukuje doświadczonych Konstruktorów Elektroników.|1|2019-10-11 16:42:00|konstrukcja wyspecjalizowanej elektroniki, dział R&D|lokalizacja: Wrocław, obrzeża|Konstruktor Elektronik R&D|Konstruktor Elektronik R&D|39035|Wrocław|Wrocław|Wrocław|https://www.michaelpage.pl/job-detail/konstruktor-elektronik-rd/ref/35431
35356_MP_PL|35356|MP|I2P Expert Team Member with Dutch |en|PL||1|2019-10-15 10:02:20|1|1|0|Our Client is a global paints and coatings company which is delivering the high-performance products. The newly opened Regional Accounting Center delivers accounting and reporting services for the businesses that it serves.|1|2019-10-15 10:02:20|Join international and well-known organisation|New SSC in Warsaw|I2P Expert Team Member with Dutch |I2P Expert Team Member with Dutch |39054|Warsaw|Warsaw|Warsaw|https://www.michaelpage.pl/en/job-detail/i2p-expert-team-member-dutch/ref/35356
35493_MP_PL|35493|MP|Accountant (m/f)|en|PL||1|2019-10-15 10:15:26|1|1|0|Our Client is looking for Accountant who would like to grow within Acc. Dept. Under the supervision of well qualified Chief Accountant and Finance Manager, You'll be responsible for accounting activities.|1|2020-02-26 10:20:10|Global Leader - Oil & Gas Industry / Technologies, Systems & Services Provider|SAP / AP,AR,GL Reconciliation / (JPK-VAT) File prep. |Accountant (m/f)|Accountant (m/f)|39049|Kraków|Kraków|Kraków|https://www.michaelpage.pl/en/job-detail/accountant-mf/ref/35493
35510_MP_PL|35510|MP|Production Manager - FMCG FOOD |pl|PL||1|2019-10-15 15:32:13|200000|200000|0|Dla naszego klienta, międzynarodowej spółki produkcyjnej, poszukujemy kandydatów z kilkuletnim doświadczeniem zawodowym w obszarze zarządzania produkcją.<br><br>Preferowany profil zawodowy to osoba, która budowała doświadczenia zawodowe w sektorze spożywczym w zautomatyzowanym środowisku produkcyjnym.|1|2019-10-15 15:32:13|Międzynarodowa spółka produkcyjna - sektor spożywyczy |Zautomatyzowany park maszynowy, interesujące wyzwanie menadżerskie |Production Manager - FMCG FOOD |Production Manager - FMCG FOOD |39051|Mazowieckie|Masovia|Mazowieckie|https://www.michaelpage.pl/job-detail/production-manager-fmcg-food/ref/35510
